ProductId,ItemId,SUPPLIER (user input),DESCRIPTION,QTY,UNITS,"BOX
COST","UNITS
PER BOX",HST,WEEK,"41,39,30,28,26,24,22,20,18,16,15,14,13,11,7,5,2,1"
8169514.0,SAY005,,SAMYANG BULDAK BOKKUMYUN M 700G,1.0,CASE,$117.40,16.0,NO,W41,
10366471.0,GLI009,,GLICO POCKY CHOCO BANANA 70G,2.0,CASE,$22.50,10.0,NO,W41,
20630331.0,GLI001,,GLICO POCKY STRAWBERRY BAG 156G,2.0,CASE,$21.50,5.0,NO,W41,
15757620.0,GLI017,,GLICO POCKY COOKIES & CREAM 70G,2.0,CASE,$22.50,10.0,NO,W41,
8170520.0,YNY058,,Y Y BRAND SEA GREENS SEAWEED SPICY 15G,1.0,CASE,$44.00,24.0,NO,W41,
8170519.0,YNY059,,Y Y BRAND SEA GREENS SEAWEED BBQ 15G,1.0,CASE,$44.00,24.0,NO,W41,
19036588.0,YNY073,,YY SUSHI NORI 28G,1.0,CASE,$22.33,10.0,NO,W41,
15757675.0,LZU003,,WATSON LONG THIN NOODLE 440G,1.0,CASE,$51.30,18.0,NO,W41,
18737379.0,CHY002,,CHEWY JAPANESE UDON NOODLES 800G,1.0,CASE,$37.29,9.0,NO,W41,
15016482.0,INM007,,INDOMIE MI BBQ CHICKEN FRIED NOODLE 425G,1.0,CASE,$22.00,6.0,NO,W41,
20682740.0,PAL001,,PALDO JJAJANGMEN NOODLE MULTIS 812G,1.0,CASE,$70.00,8.0,NO,W41,
8169512.0,SAY009,,SAMYANG BULDAK BOKKUMYUN CARBO M 130GX5,3.0,CASE,$65.00,8.0,NO,W41,
18256061.0,LZU001,,WATSON LANZHOU NOODLE 440G,1.0,CASE,$50.00,18.0,NO,W41,
9379954.0,YNY020,,Y & Y 3 MINUTE CHOWMEIN 454G,1.0,CASE,$24.00,12.0,NO,W41,
23584101.0,LKK076,,LKK CHINESE MARINADE 410ML,1.0,CASE,$48.00,12.0,NO,W41,
10472728.0,LKK088,,LKK HOISIN SAUCE 443ML,1.0,CASE,$47.00,12.0,NO,W41,
14811898.0,LKK090,,LKK PURE SESAME OIL 445ML,1.0,CASE,$96.00,12.0,NO,W41,
8180481.0,MAP006,,MAEPLOY RED CURRY PASTE 400G,1.0,CASE,$75.00,24.0,NO,W41,
10368195.0,MSR005,,MAESRI GREEN CURRY PASTE 114G,1.0,CASE,$58.00,48.0,NO,W41,
8370478.0,PRB005,,PRB LIGHT SOY SAUCE 500ML,1.0,CASE,$31.00,12.0,NO,W41,
23805224.0,PRB006,,PRB MUSHROOM SOY SAUCE 500ML,1.0,CASE,$39.00,12.0,NO,W41,
12532371.0,PRB007,,PRB DARK SOY SAUCE 500ML,1.0,CASE,$50.00,12.0,NO,W41,
8170502.0,SNB001,,S B WASABI IN TUBE 43G,1.0,CASE,$24.00,10.0,NO,W41,
18966469.0,GLI002,,GLICO POCKY CHOCOLATE BAG 156G,2.0,CASE,$21.50,10.0,NO,W41,
21991002.0,OTT003,,OTTOGI JIN CUP MILD 65G,2.0,CASE,$13.00,6.0,NO,W39,
21991041.0,OTT004,,OTTOGI JIN CUP SPICY 65G,2.0,CASE,$13.00,6.0,NO,W39,
22007112.0,PAL014,,PALDO BIBIM MEN 520G,2.0,CASE,$28.00,6.0,NO,W39,
20682740.0,PAL003,,PALDO JJAJANGMEN NOODLE MULTIS 812G,2.0,CASE,$29.00,4.0,NO,W39,
18285321.0,PAL007,,PALDO VOLCANO CHK NDL 140GX4,2.0,CASE,$25.00,4.0,NO,W39,
19781715.0,SAY017,,SAMYANG CHEESE BOWL 105G,2.0,CASE,$43.00,16.0,NO,W39,
8180820.0,SAY016,,SAMYANG BULDAK HOT CHICKEN CHEESE 700G,2.0,CASE,$61.50,8.0,NO,W39,
9378047.0,YNY039,,Y&Y BROWN RICE VERMICELLI 400G,1.0,CASE,$50.00,20.0,NO,W39,
12835559.0,HMK001,,HANAMARUKI SOYBEAN PASTE WHITE 500G,2.0,CASE,$28.00,6.0,NO,W39,
17189952.0,HMK002,,HANAMARUKI SOYBEAN PASTE RED 500G,2.0,CASE,$28.00,6.0,NO,W39,
8181044.0,OTH015,,KEWPIE MAYONNAISE 517ML,1.0,CASE,$157.00,20.0,NO,W39,
14811915.0,KDY001,,KADOYA ROASTED SEASAME OIL 163ML,1.0,CASE,$120.00,24.0,NO,W39,
8170545.0,LKK094,,LKK CHAR SIU SAUCE 320ML,1.0,CASE,$60.00,12.0,NO,W39,
22351784.0,LKK120,,LKK CHICKEN MARINADE 410ML,1.0,CASE,$48.00,12.0,NO,W39,
22676205.0,LKK020,,LKK CHILI BEAN SAUCE 368G,1.0,CASE,$57.00,12.0,NO,W39,
8170547.0,LKK132,,LKK CHILI OIL 207ML,1.0,CASE,$36.00,12.0,NO,W39,
22008568.0,LKK049,,LKK KOREAN BBQ SAUCE 370G,1.0,CASE,$45.00,12.0,NO,W39,
22007961.0,LKK098,,LKK OYSTER SAUCE KUM CHUN 480G,1.0,CASE,$30.00,12.0,NO,W39,
19782066.0,LKK001,,LKK PANDA OYSTER SAUCE 510G,1.0,CASE,$48.00,12.0,NO,W39,
22677193.0,LKK074,,LKK PREMIUM DARK SOY SAUCE 500ML,1.0,CASE,$36.00,12.0,NO,W39,
18864471.0,LKK111,,LKK PREMIUM OYSTER SAUCE 510G,1.0,CASE,$96.00,12.0,NO,W39,
8872125.0,LKK065,,LKK CHILI GARLIC SAUCE 226G,1.0,CASE,$39.00,12.0,NO,W39,
21996852.0,LKK068,,LKK TERIYAKI SAUCE 207ML,1.0,CASE,$27.00,12.0,NO,W39,
8170517.0,YNY056,,Y Y BRAND SEA GREENS SEAWEED CLASSIC 15G,1.0,CASE,$44.00,24.0,YES,W39,
8170518.0,YNY057,,Y Y BRAND SEA GREENS SEAWEED GARLIC 15G,1.0,CASE,$44.00,24.0,YES,W39,
8170521.0,YNY043,,Y Y SHITAKE MASHROOMS 284 ML,1.0,CASE,$28.01,24.0,NO,W39,
18502273.0,VTS009,,VITASOY COCONUT 6PACK,,CASE,$42.00,8.0,NO,W30,
12222935.0,VTS002,,VITASOY ORIGINAL 6PACK,,CASE,$44.00,8.0,NO,W30,
20845030.0,VTS021,,VITA SUGAR CANE JUICE DRINK 6PK,2.0,CASE,$42.00,8.0,NO,W30,
8180777.0,BRA006,,BRANDS BIRDS NEST SOUP 408ML,1.0,CASE,$448.00,8.0,YES,W30,
12532274.0,ASI005,,ASSI KATSUO UDON NOODLE BOWL 235G,2.0,CASE,$25.00,6.0,NO,W30,
8170314.0,INM004,,INDOMIE PEDAS HOT STIRFRY NDLS 5PACK 80G,2.0,CASE,$21.60,6.0,NO,W30,
8170313.0,INM001,,INDOMIE MI GORENG FRIED NOODLES 85G,2.0,CASE,$19.20,6.0,NO,W30,
20641441.0,MMA008,,MAMA PORK MULTIPACK 5X300G,,CASE,$22.00,6.0,NO,W30,
20702590.0,NOS004,,NONG SHIM BIG BOWL SHIN 114G,2.0,CASE,$29.00,12.0,NO,W30,
8169510.0,NOS035,,NONGSHIM SHIN RAMEN BLACK MULTI 520G,2.0,CASE,$40.00,4.0,NO,W30,
8169511.0,NOS034,,NONGSHIM SHIN RAMEN M 480G,2.0,CASE,$24.00,4.0,NO,W30,
14902444.0,PAL002,,PALDO HWA RAMYUN HOT AND SPICY 600G,2.0,CASE,$30.00,4.0,NO,W30,
,SAY016,,BULDAK HOT CHICKEN CHEESE 700G,2.0,CASE,$61.50,8.0,NO,W30,
8170526.0,ABC001,,ABC SWEET SOY SAUCE 620ML,1.0,CASE,$85.68,12.0,NO,W30,
8173357.0,MAP002,,MAEPLOY RED CURRY PASTE 1KG,1.0,CASE,$92.00,12.0,NO,W30,
8170546.0,LKK072,,LKK CHILI BLACK BEAN SAUCE 230G,1.0,CASE,$54.00,12.0,NO,W28,
14722650.0,LKK103,,LKK MUSHROOM DARK SOY SAUCE 500ML,1.0,CASE,$36.00,12.0,NO,W28,
18864483.0,LKK185,,LKK DUMPLING SAUCE 207ML,1.0,CASE,$69.00,12.0,NO,W28,
8170548.0,LKK005,,LKK LG BLACK BEAN GARLIC 368G,1.0,CASE,$60.00,12.0,NO,W28,
18768077.0,ORY002,,OH RICEY PHO BEEF BOWL 65G,1.0,CASE,$17.00,12.0,NO,W28,
18768073.0,ORY006,,OH RICEY PHO CHICKEN BOWL 65G,1.0,CASE,$17.00,12.0,NO,W28,
8170497.0,OTH014,,ORION CUSTARD 276G,1.0,CASE,$56.50,8.0,NO,W28,
8170493.0,NOS022,,NONG SHIM SHRIMP CRACKERS 75G,1.0,CASE,$29.50,20.0,NO,W28,
14737177.0,LKK027,,LKK SESAME SOYBEAN MIXED OIL 207ML,1.0,CASE,$45.00,12.0,NO,W28,
15733684.0,HAK003,,HAKUBAKU ORGANIC UDON 269g,1.0,CASE,$24.00,8.0,NO,W28,
15733673.0,HAK001,,HAKUBAKU ORGANIC SOMEN 269g,1.0,CASE,$24.00,8.0,NO,W28,
16980174.0,LKM017,,LUCKY ME PANCIT CANTON SWEET &SPICY 360G,1.0,CASE,$43.20,12.0,NO,W26,
18127362.0,LKM015,,LUCKY ME PANCIT CANTON KALAMANSI 360G,1.0,CASE,$43.20,12.0,NO,W26,
14722670.0,LKK087,,LKK 36OZ HOISIN SAUCE 797ML,1.0,CASE,$72.00,12.0,NO,W26,
8173338.0,SQU001,,SQUID BRAND FISH SAUCE 725ML,2.0,CASE,$52.00,24.0,NO,W26,
8169625.0,LOT012,,LOTTE CHOCO PIE 12PK 336G,1.0,CASE,$36.00,8.0,NO,W26,
17605284.0,WAN001,,WANT RICE CRACKER 92G,1.0,CASE,$51.00,20.0,NO,W26,
20267909.0,ASI003,,ASSI STRAWBERRY FLAVOUR DRINK 315ML,1.0,CASE,$21.21,20.0,NO,W26,
20010969.0,WPC001,,WEL-PAC EDAMAME BEANS 454G,1.0,CASE,$72.50,20.0,NO,W24,
18069704.0,KIK006,,KIKKOMAN MISO SOUP MIX SPINACH 30G,1.0,CASE,$87.00,24.0,NO,W24,
8170540.0,KIK002,,KIKKOMAN MISO SOUP MIX WITH TOFU 30G,1.0,CASE,$87.00,24.0,NO,W24,
8170496.0,ORY001,,OH RICEY DRIED RICE NOODLE 500G,1.0,CASE,$68.00,18.0,NO,W24,
20011023.0,HYF007,,HUY FONG KETCHUP 490ML,2.0,CASE,$27.00,6.0,NO,W24,
8170509.0,LKK004,,LKK VEG MUSH STIR FRY SAUCE 567G,1.0,CASE,$48.16,12.0,NO,W24,
12222880.0,LKK011,,LKK VEG STIR FRY SAUCE 421ML,1.0,CASE,$52.00,12.0,NO,W24,
8173385.0,MAP003,,MAEPLOY SWEET CHILLI SAUCE 730ML,1.0,CASE,$37.00,12.0,NO,W24,
16980146.0,LKM003,,LUCKY ME INS PANCIT CANTON HOT CHILI 60G,1.0,CASE,$42.00,12.0,NO,W22,
8170514.0,LZU002,,WATSON SLICED NOODLE 440G,1.0,CASE,$50.00,18.0,NO,W22,
19781889.0,LKK117,,LKK BROWN BRAISING SAUCE 410ML,1.0,CASE,$39.00,12.0,NO,W22,
19782059.0,LKK067,,LKK GUILIN CHILI SAUCE 226G,1.0,CASE,$46.37,12.0,NO,W22,
8173333.0,MAP001,,MAEPLOY COCONUT MILK CREAM 560ML,1.0,CASE,$85.00,24.0,NO,W22,
8170320.0,MAP004,,MAEPLOY CURRY PASTE GREEN 1KG,1.0,CASE,$92.00,12.0,NO,W22,
19550668.0,LKK057,,LKK SEASONED RICE VINEGAR 500ML,1.0,CASE,$33.00,12.0,NO,W20,
14722656.0,LKK029,,LKK SRIRACHA MAYO 445ML,1.0,CASE,$67.97,12.0,NO,W20,
16506758.0,MRN001,,MARUKAN GOURMET RICE VINEGAR 355ML,1.0,CASE,$43.00,12.0,NO,W20,
17307541.0,MRN002,,MARUKAN BREWED RICE VINEGAR 355ML,1.0,CASE,$42.00,12.0,NO,W20,
8170499.0,PGD001,,PAGODA SHAOXIN SALTED COOKING WINE 640ML,1.0,CASE,$38.00,12.0,NO,W20,
17468117.0,GLI014,,GLICO POCKY CRUNCHY STRAWBERRY 51G,2.0,CASE,$27.00,10.0,YES,W20,
10366453.0,GLI010,,GLICO POCKY CHOCOLATE 70G,2.0,CASE,$23.33,10.0,YES,W20,
15757552.0,GLI003,,GLICO POCKY CHOCOLATE SMALL 40G,2.0,CASE,$12.10,10.0,YES,W20,
11639299.0,GLI005,,GLICO POCKY STRAWBERRY 33G,2.0,CASE,$12.00,10.0,YES,W20,
12765082.0,HTI001,,HAITAI HONEY BUTTER CHIPS 60G,1.0,CASE,$48.80,16.0,NO,W20,
19550734.0,NTC005,,NATURES CHARM COCONUT CUSTARD 400G,1.0,CASE,$85.00,24.0,NO,W20,
15016468.0,MMA003,,MAMA INST NOODLES CHICKEN FLAVOUR 55G,2.0,CASE,$16.80,24.0,NO,W20,
8169041.0,MMA001,,MAMA INST NOODLES PORK FLAVOUR 60G,2.0,CASE,$16.80,24.0,NO,W20,
18601471.0,VTS022,,VITASOY BLACK 6PACK,2.0,CASE,$36.00,8.0,NO,W18,
8170512.0,VTS025,,VITASOY MELON FLV SOYA DRINK 6PACK,2.0,CASE,$36.00,8.0,NO,W18,
15002674.0,VTS024,,VITASOY CHOCOLATE FLV SOY DRINK 6PACK,2.0,CASE,$36.00,8.0,NO,W18,
19276970.0,YNY066,,YY WHOLE WATER CHESTNUT 227G,1.0,CASE,$30.00,24.0,NO,W18,
19277111.0,WAN002,,WANT CRISP RICE CRACKER ROUND 150G,1.0,CASE,$65.90,20.0,NO,W18,
8170533.0,DNY003,,DYNASTY WATERCHESTNUT SLICED 227G,1.0,CASE,$19.00,12.0,NO,W18,
19277000.0,CJO001,,DAESANG HOT PEPPER PASTE YELLOW LID 1KG,1.0,CASE,$140.00,12.0,NO,W18,
9734766.0,INM001,,INDOMIE MI GORENG FRIED NOODLE 425G,1.0,CASE,$19.20,6.0,NO,W18,
12835559.0,,,HANAMARUKI SOYBEAN PASTE WHITE 500G,2.0,CASE,$27.00,6.0,NO,W16,
8170525.0,,,SAMBAL OELEK 213G,2.0,CASE,$62.40,24.0,NO,W16,
8170534.0,,,FISH SAUCE LUCKY 700ML,1.0,CASE,$19.20,12.0,NO,W16,
19036185.0,,,FARMER ROAST PEANUT 400G,1.0,CASE,$130.08,24.0,NO,W16,
19036588.0,,,YY SUSHI NORI 28G,1.0,CASE,$22.33,10.0,NO,W16,
19036199.0,,,CHEWY JAPANESE RAMEN NOODLES GREEN 800G,1.0,CASE,$48.50,12.0,NO,W16,
18737379.0,,,CHEWY JAPANESE UDON NOODLES 800G,1.0,CASE,$37.29,9.0,NO,W16,
19036205.0,,,SAMYANG CARBO BOWL 150G,1.0,CASE,$37.80,16.0,NO,W16,
18966461.0,,,NISSIN BEEF NOODLES MULTI 100GX5,1.0,CASE,$30.00,6.0,NO,W15,
18966469.0,,,GLICO POCKY CHOCOLATE BAG 156G,2.0,CASE,$21.50,10.0,NO,W15,
10366453.0,,,GLICO POCKY CHOCOLATE 70G,2.0,CASE,$23.33,20.0,NO,W15,
10366471.0,,,GLICO POCKY CHOCO BANANA 70G,2.0,CASE,$22.50,20.0,NO,W15,
15757620.0,,,GLICO POCKY COOKIES & CREAM 70G,2.0,CASE,$22.50,20.0,NO,W15,
17468117.0,,,GLICO POCKY CRUNCHY STRAWBERRY 51G,2.0,CASE,$27.00,20.0,NO,W15,
8170512.0,,,VITASOY MELON FLV SOYA DRINK 6PACK,2.0,CASE,$46.00,16.0,NO,W15,
15002674.0,,,VITASOY CHOCOLATE FLV SOY DRINK 6PACK,2.0,CASE,$44.00,16.0,NO,W15,
18502273.0,,,VITASOY COCONUT 6PACK,2.0,CASE,$42.00,16.0,NO,W15,
9734766.0,,,INDOMIE MI GORENG FRIED NOODLE 425G,2.0,CASE,$21.00,12.0,NO,W15,
19036393.0,,,HUY FONG SRIRACHA HOT CHILLI 433ML,2.0,CASE,$63.00,12.0,NO,W15,
18966548.0,,,TYJ PEANUT RICE BALL 200G,1.0,CASE,$45.00,24.0,NO,W15,
8181044.0,,,KEWPIE MAYONNAISE 517ML,1.0,CASE,$157.00,20.0,NO,W15,
18864458.0,NOS015,,NONGSHIM OOLONG NOODLE SEAFOOD 75G,1.0,CASE,$9.72,6.0,NO,W14,
8170504.0,SAY011,,SAMYANG HOT CHICK FLA RAM 2X SPICY 700G,2.0,CASE,$64.00,8.0,NO,W14,
18864464.0,KRI002,,KINJIRUSHI WASABI POWDER 25G,1.0,CASE,$30.00,10.0,NO,W14,
18864471.0,LKK006,,LKK PREMIUM OYSTER SAUCE 510G,1.0,CASE,$192.00,24.0,NO,W14,
18864495.0,LKK013,,LKK SRIRACHA CHILI SAUCE 445ML,1.0,CASE,$51.04,12.0,NO,W14,
8170510.0,VTS024,,VITASOY CHOCOLATE FLV SOY DRINK 250ML,2.0,CASE,$44.00,48.0,NO,W13,
18094208.0,SHB008,,TYJ SESAME GLUT RICE BALL 200G,1.0,CASE,$45.00,24.0,NO,W13,
8169627.0,LOT009,,LOTTE MILKIS 1.5L,1.0,CASE,$54.00,12.0,YES,W13,
18767617.0,MPP001,,MARBLE POP GREEN APPLE DRINK 200ML,1.0,CASE,$36.00,12.0,YES,W13,
18767628.0,MPP004,,MARBLE POP BLUEBERRY 200ML,1.0,CASE,$35.00,12.0,YES,W13,
10472728.0,,,LKK HOISIN SAUCE 443ML,1.0,CASE,$42.00,12.0,NO,W11,
18601471.0,,,VITASOY BLACK 6PACK,2.0,CASE,$36.00,8.0,NO,W11,
12222935.0,,,VITASOY ORIGINAL 6PACK,2.0,CASE,$36.00,8.0,NO,W11,
15757675.0,,,WATSON LONG THIN NOODLE 440G,1.0,CASE,$51.30,18.0,NO,W11,
8170314.0,,,INDOMIE PEDAS HOT STIRFRY NDLS 5PACK 80G,2.0,CASE,$21.60,6.0,NO,W11,
15016482.0,,,INDOMIE MI BBQ CHICKEN FRIED NOODLE 425G,2.0,CASE,$19.20,6.0,NO,W11,
18127362.0,,,LUCKY ME PANCIT CANTON KALAMANSI 360G,1.0,CASE,$43.20,12.0,NO,W11,
16980174.0,,,LUCKY ME PANCIT CANTON SWEET &SPICY 360G,1.0,CASE,$42.00,12.0,NO,W11,
18481495.0,,,LUCKY ME PANCIT CANTON ORI 360G,1.0,CASE,$43.20,12.0,NO,W11,
17189832.0,,,PALDO BUL NAK PAN STIR FRY NOODLES 4PKS,2.0,CASE,$25.00,4.0,NO,W11,
8170514.0,,,WATSON SLICED NOODLE 440G,1.0,CASE,$50.00,18.0,NO,W11,
18256061.0,,,WATSON LANZHOU NOODLE 440G,1.0,CASE,$50.00,18.0,NO,W11,
8170526.0,,,ABC SWEET SOY SAUCE 620ML,1.0,CASE,$85.68,12.0,NO,W11,
17189952.0,,,HANAMARUKI SOYBEAN PASTE RED 500G,2.0,CASE,$27.00,6.0,NO,W11,
8180481.0,,,MAEPLOY RED CURRY PASTE 400G,1.0,CASE,$75.00,24.0,NO,W11,
8170497.0,,,ORION CUSTARD 276G,1.0,CASE,$56.50,8.0,NO,W11,
8170268.0,,,BRANDS ESSENCE OF CHICKEN 68ML,1.0,CASE,$216.00,12.0,YES,W11,
8170486.0,,,LKK PURE BLACK SESAME OIL 207ML,1.0,CASE,$54.00,12.0,NO,W7,
12532371.0,,,PRB DARK SOY SAUCE 500ML,2.0,CASE,$50.00,12.0,NO,W7,
15757552.0,,,GLICO POCKY CHOCOLATE SMALL 40G,2.0,CASE,$12.10,10.0,YES,W7,
,,,GLICO POCKY COOKIES & CREAM  70G,2.0,CASE,$22.50,10.0,YES,W7,
16506758.0,,,MARUKAN GOURMET RICE VINEGAR 355ML,2.0,CASE,$42.00,12.0,NO,W7,
17183018.0,,,NONGSHIM KIMCHI OOLONG CUP 75G,2.0,CASE,$9.50,6.0,NO,W7,
8170519.0,,,Y Y BRAND SEA GREENS SEAWEED BBQ 15G,2.0,CASE,$44.00,24.0,NO,W7,
8170517.0,,,Y Y BRAND SEA GREENS SEAWEED CLASSIC 15G,2.0,CASE,$44.00,24.0,NO,W7,
8170518.0,,,Y Y BRAND SEA GREENS SEAWEED GARLIC 15G,2.0,CASE,$44.00,24.0,NO,W7,
8170520.0,,,Y Y BRAND SEA GREENS SEAWEED SPICY 15G,2.0,CASE,$44.00,24.0,NO,W7,
8170521.0,,,Y Y SHITAKE MASHROOMS 284 ML,1.0,CASE,$28.01,24.0,NO,W7,
8170546.0,,,LKK CHILI BLACK BEAN SAUCE 230G,1.0,CASE,$48.00,12.0,NO,W7,
8169625.0,,,LOTTE CHOCO PIE 12PK 336G,1.0,CASE,$36.00,8.0,NO,W7,
18313797.0,,,NONG SHIM SHRIMP CHIP 45G,1.0,CASE,$35.00,20.0,NO,W7,
14902381.0,,,MARBLE POP STRAWBERRY DRINK 200ML,2.0,CASE,$38.00,12.0,NO,W7,
14825762.0,,,MAESRI CAN CURRY PASTE RED 114G,1.0,CASE,$58.00,48.0,NO,W7,
8170536.0,,,GOLD PLUM CHINKIANG VINEGAR 550ML,1.0,CASE,$65.00,24.0,NO,W7,
15757628.0,OTT001,,OTTOGI JIN RAMEN MILD MULTI PACK 480G,1.0,CASE,$45.00,8.0,NO,W5,
12532350.0,YNY052,,Y&Y RICE STICK 5MM 454G,1.0,CASE,$50.00,20.0,NO,W5,
10739815.0,YNY053,,Y&Y RICE STICK 10MM 454G,1.0,CASE,$44.00,20.0,NO,W5,
,LZU001,,WATSON LANGHOU NOODLE 440G,1.0,CASE,$50.00,18.0,NO,W5,
8872538.0,MRN004,,MARUKAN YUZU PONZU 355ML,2.0,CASE,$42.00,6.0,NO,W5,
17307541.0,MRN001,,MARUKAN BREWED RICE VINEGAR 355ML,2.0,CASE,$43.00,12.0,NO,W5,
14722667.0,YMS001,,YAMASA SOY SAUCE 148ML,1.0,CASE,$33.00,12.0,NO,W5,
14722657.0,YMS002,,YAMASA LESS SALT SOY SAUCE 148ML,1.0,CASE,$40.00,12.0,NO,W5,
8169625.0,LOT001,,LOTTE CHOCO PIE 12PK 336G,1.0,CASE,$37.00,12.0,NO,W3,
8872105.0,LKK025,,LKK BLACK BEAN GARLIC SAUCE 226G,1.0,CASE,$36.00,12.0,NO,W3,
8311214.0,HMK001,,SHIRO MISO WHITE PASTE 907G,1.0,CASE,$27.00,6.0,NO,W3,
8169510.0,NOS027,,NONGSHIM SHIN RAMEN BLACK MULTI 520G,2.0,CASE,$53.80,12.0,NO,W3,
10366453.0,GLI009,,GLICO POCKY CHOCOLATE 70G,2.0,CASE,$22.50,20.0,NO,W1,
,GLI017,,GLICO POCKY COOKIES & CREAM  70G,2.0,CASE,$22.50,20.0,NO,W1,
8170511.0,VTS009,,VITASOY COCONUT SOY DRINK 250ML,3.0,CASE,$42.00,24.0,NO,W1,
8872147.0,DNY002,,DYNASTY WHOLE WATER CHESTNUT 227G,1.0,CASE,$18.00,12.0,NO,W1,
17468052.0,HPI001,,HAPI WASABI GREEN PEAS 140G,1.0,CASE,$130.00,24.0,YES,W1,
8170504.0,SAY005,,SAMYANG HOT CHICK FLA RAM 2X SPICY 700G,2.0,CASE,$58.70,16.0,NO,W1,
15757675.0,LZU002,,WATSON LONG THIN NOODLE 440G,2.0,CASE,$50.00,36.0,NO,W1,
8180876.0,CCT001,,COCO TREE CHOW MEIN VEG MI CHAY S 400G,1.0,CASE,$48.00,12.0,NO,W1,
17468020.0,CCT002,,COCO TREE CHOW MEIN MI TRUNG S 400G,1.0,CASE,$48.00,12.0,NO,W1,
8190010.0,HASA001,,HANA SOBA JAPANESE STYLE NOODLE 800G,1.0,CASE,$105.00,18.0,NO,W1,
24352660.0,YNY040,,YY GLUTINOUS RICE FLOUR 400G,,,,,,W48,
22761666.0,HAK004,,HAKUBAKU ORGANIC RAMEN 269g,,,,,,W48,
8170537.0,HAK002,,HAKUBA ORG SOBA BUCK NDL 269G,,,,,,W48,
9733939.0,NOS016,,NONGSHIM SHIN CUP 75G,,,,,,W48,
19783656.0,NOS009,,NS SOON VEGGIE CUP 75G,,,,,,W48,
8170536.0,GPM001,,GOLD PLUM CHINKIANG VINEGAR 550ML,,,,,,W48,
12222911.0,HYF006,,SAMBAL OELEK 476ML,,,,,,W48,
24352675.0,LKK017,,LKK ALL PURPOSE MARINADE 410ML,,,,,,W48,
24352680.0,LKK089,,LKK CHICKEN POWDER 1KG,,,,,,W48,
24352688.0,LKK081,,LKK DRUNKEN CHICKEN MARINADE 410ML,,,,,,W48,
22677193.0,LKK047,,LKK PREMIUM DARK SOY SAUCE 500ML,,,,,,W48,
,LKK125,,LKK SELECTED FIVE SPICE MARINADE 410ML,,,,,,W48,
